Content,Classification
"In 1995, there were nursery vouchers for a few, but only 4% of children under five in England were in nursery: the right argued young children were the responsibility of families, not the state, and that mothers should stay at home. Labour’s strong cohort of women arriving in the Commons in 1997, led by the veteran Harriet Harman with her childcare strategy, fought hard to finally add the missing cradle to the “cradle to grave” welfare state. In 2003, the Treasury introduced childcare tax credits, although more as a way to get women into work.",Fact
"The crew includes NASA’s Reid Wiseman, a Navy test pilot and single father who will serve as commander of the mission; Victor Glover, a naval test pilot who will become the first Black person to travel to deep space; Christina Koch, an engineer and record-holding astronaut who will become the first woman to venture to the moon; and the Canadian Space Agency’s Jeremy Hansen, a fighter pilot who will be the first non-NASA astronaut to join a lunar mission.",Fact
"""This new expansion introduces a major feature: allowing players, alone or in co-op, to explore new demolition and salvage gameplay options. Demolition is a strategic choice that allows materials to be salvaged and reused elsewhere, bringing a new sense of autonomy to RoadCraft's gameplay. You can now rebuild your own way as decisions directly reshape the environment, influencing future missions.""",Fact
"Still, it's a little confusing to see Apple upgrading its premium headphones after so long without any meaningful hardware changes. The AirPods Max's general design appears just as unwieldy as before, with the same heavy aluminum chassis, and there's no mention of an upgrade to the rubberized “case” that wraps around the earpads with little protection for travel.",Opinion
"More than 30 years ago, a group of physicists needed a name for a radical new idea they’d come up with for how to transfer the quantum states of atoms or subatomic particles to other, distant particles without ever physically interacting with them. A quantum state is a mathematical concept representing information about an atom or subatomic particle—for instance, the energy level of an electron or the polarization of a photon.",Fact
"The powerhouses that were fuelled by venture capital money and easy traffic from search and social are either gone, or are struggling on as pale shadows of their former selves. This, though, isn't the end of digital journalism, despite the general gloom and doom tone of a lot of media industry reporting of late. This is merely the end of its second era, as those companies that failed to evolve and adapt die to make way for new publications.",Opinion
"A law introduced on March 28 last year by emergency decree states that only those with a parent or grandparent born in Italy will be recognized as citizens. It also effectively outlaws dual citizenship for the diaspora, as that parent or grandparent must have held solely Italian citizenship at the time of their descendant’s birth, or at their own death if it came earlier.",Fact
"Our brains are amazingly useful things. But it seems that something's broken in our relationship with them. As humans, we often feel that we are at war with ourselves. We want what we cannot have and need what we don't want. We get addicted to bad things and lose interest in good things. We ruminate, we obsess, we snap, we regret. It is as if we are always trying to get to some fuller, better, more complete, more natural version of our lives and never quite get there.",Opinion
"Three decades into live talk radio, I listen for a living. I’m adept at noticing micro-expressions, the pauses, the shifts in tone, the feelings that sit between the words on and off air. And I keep wondering: why are we so bad at talking about infertility? This is even something that, until now, I haven’t spoken publicly about. Perhaps it’s because we still live in a society in which motherhood is, for many, the expected norm. When something is assumed to be inevitable, its absence can make people uncomfortable.",Opinion
"Martin Lewis has warned that millions of households face a “ticking timebomb” on their energy bills as global fuel prices surge amid the conflict involving the United States, Israel and Iran. The MoneySavingExpert founder said families could see costs rise by as much as 30 per cent if elevated oil and gas prices persist for several months.",Opinion
"Although it feels like Privacy Display just launched, Samsung is already showing off new ways to use it that are labeled ""under development."" At the show, Samsung Display revealed an experimental feature that lets you enable the Privacy Display feature for certain parts of the screen. For instance, this developmental feature would make it possible to only block the top or bottom of the screen as needed.",Opinion
"When an 82-year-old Kentucky woman was offered $26 million from an AI company that wanted to build a data center on her land, she said no. Sure, that same company can try to rezone 2,000 acres nearby anyway, but as AI infrastructure stretches further into the real world, the real world is starting to push back.",Opinion
""" The Minnesota Vikings agreed to terms Tuesday on a contract with four-time All-Pro punter Johnny Hekker, who will begin his 15th season in the NFL.
The 36-year-old Hekker spent last season with the Tennessee Titans. He played three years with the Carolina Panthers after spending his first 10 seasons with the Los Angeles Rams. He started with the Rams franchise in St. Louis in 2012 as an undrafted free agent out of Oregon State.""",Fact
"Beyond our personal experience as airline captains who fly internationally, conclusive research, such as a 2017 study by NASA and the FAA, clearly lays out the unacceptable safety risk posed by single-pilot flight operations, especially during abnormal events.
Despite this evidence, at least one aircraft manufacturer is pressuring international aviation bodies to put profits first and introduce an unacceptable level of safety risk to commercial aviation.",Opinion
"Every single Sunday morning begins with pancakes… and ends with leftover pancakes. These are everything you want in a pancake. They’re soft and so fluffy… each mouthful melts in your mouth, making this great recipe from scratch is so much better than the store bought powdered mix. You’ll be reaching for more than one… stack. Possibly. Probably.",Opinion
"Washington, D.C. flew into a panic last weekend. Schools closed, parents scrambled, flights were canceled, and mayors declared emergencies.There's a storm coming!"" people in and around the nation's capital exclaimed to one another Sunday night. ""Are you ready? Charge your phone, so you can call for help! But unplug your laptop, because of lightning! Prune the trees! Fill your bathtubs! Juice up your generator! Stay away from windows! Hoard power bars! Hunker down!,",Opinion
"A number of Pixel Watch owners on Reddit have reported over the past week or so that there are issues with step counts in Fitbit, as well as some other stats. One sees the Pixel Watch overcounting steps, with the numbers being doubled in some cases both in steps as well as other stats such as mileage.",Fact
"The good bits first, and they are truly good. Project Silica is a Microsoft research effort into data storage in glass, not in itself a new idea but one with plenty of innovation. It's gone through various iterations of how to write data into different sorts of glass matrices and how to read it out again. Project Silica can now store 2 TB in hundreds of layers within a 2 mm thick borosilicate glass plate. There are femtosecond laser pulses and machine learning readers. Proper science-led engineering.",Opinion
"There is no specific data collection for lithium battery-related fires in England and Wales. In Scotland, according to the latest freedom of information data from the Scottish fire and rescue service, there were 69 lithium battery-related fires in 2025, compared with 20 in 2019, with last year’s figures including 10 house fires, two in hospitals and three in prisons. According to data going back to 2009, there have been no related fatalities in Scotland.",Fact
"After two and a half years of negative economic growth, headwinds will subside in 2025: Inflation is stabilizing at 2.9%, and falling interest rates mean lower financing costs, reducing cost pressures on businesses and households. This is reflected in rising industrial and consumer confidence at the beginning of the year, which has received a considerable boost from an improved growth outlook in crucial export markets like Germany.",Fact
"Fewer heat pumps are installed in the UK than gas boilers. Installation rates are also lower than in other major European countries, like France, Germany and Italy.  But sales are increasing. Nearly 125,000 heat pumps were sold in 2025, more than double the number in 2023, according to the Heat Pump Association. However, the CCC says this number needs to rise to nearly 450,000 a year by 2030 and 1.5 million by 2035 to help meet climate targets.",Fact
"As Japan's rainy season begins, ajisai (hydrangeas) begin to bloom in soft blues, violets and pinks. With more than 100 varieties across the country, the vibrant flowers have appeared in Japanese records since the 8th Century. Parks and shrines around Tokyo and Kamakura fill with colour each June, including Asukayama Park, Sumida Park and Hakusan Shrine.",Fact
"Adding the Netherlands to Celebrity River Cruises' lineup creates an extraordinary opportunity for travellers seeking authenticity, culture, and scenic beauty. From Amsterdam's bustling streets to quiet riverside villages, visitors can enjoy an unparalleled variety of experiences. Longer port stays allow meaningful engagement with local culture, while connecting waterways offer convenient access to multiple European destinations. Whether you are an art lover, history enthusiast, or a traveller seeking authentic European lifestyle, the Netherlands promises experiences that are memorable, enriching, and unique.",Opinion
"It's hard to ignore the fact that we are living in a politically uninhabitable world. 2025 was a year defined by fear, suffering, genocide and hunger. No wonder we are already so desperate to escape 2026 - it almost seems like things really can't get that worse. But against this reality of political instability, the return of the Snapchat dog filter seems less innocent than it appears. But beneath it lies an unwillingness to confront our crumbling political landscape. Instead, we have turned to what can only be described as nostalgic regression.",Opinion
"The arrangements that followed the November 27, 2024 ceasefire between Lebanon and Israel were widely understood to be temporary and structurally weak, leaving the underlying dynamics of confrontation largely untouched. The ceasefire agreement, brokered by the United States and France, formally aimed to end active hostilities. In practice, however, the agreement never truly halted the conflict. This clause introduced a fundamental imbalance. Accountability remained elusive from the outset, leading to a relative diplomatic vacuum.",Opinion
"Industrial trans fats levels have been decreasing in selected food groups in the past decades but not uniformly across European countries. In some Central and Southern European countries, industrial trans fats levels in pre-packaged biscuits, cakes and wafers have not dropped meaningfully since mid-2000. Products with high industrial trans fats content were found in nine European countries (EU countries - Sweden, Croatia, Poland, Bulgaria and Slovenia). This suggests that in certain parts of the EU little progress has been made.",Fact
"The only information Reuters was able to squeeze out of their contacts was that the device would feature AI heavily. Real shocker there — anyone with an Echo device in their kitchen could tell you that Amazon is desperate to get you talking to their gadgets, presumably so they can convince you to buy something. While a smartphone with even more AI features we didn’t ask for certainly won’t be on our Wish List, if history is any indicator, we might be able to pick these things up cheap on the second-hand market.",Opinion
"Rae began speaking to Barry last year after the end of a difficult divorce. She was unfit and unhappy and turned to ChatGPT for advice on diet, supplements and skincare. She had no idea she would fall in love. Barry is a chatbot. He lives on an old model of ChatGPT, one that its owners OpenAI announced it would retire on 13 February.",Fact
"Statements of fact can be proved or disproved with objective evidence, whereas statements of opinion depend on personal values and preferences. Distinguishing between these types of statements contributesto information competence. Conversely, failure at fact-opinion differentiation potentially brings resistance to corrections of misinformation and susceptibility to manipulation. Our analyses show that on fact-opinion differentiation tasks, unsystematic mistakes and mistakes emanating from partisan bias occur at higher rates than accurate responses. Accuracy increases with political sophistication. Affective partisan polarization promotes systematic partisan error: As views grow more polarized, partisans increasingly see their side as holding facts and the opposing side as holding opinions",Fact
"Under the authority and guidance of the SBI Chair, the secretariat is organizing a series of activities ahead of the midterm review of the Glasgow work programme to enable deeper assessment of ACE implementation since the adoption of the work programme and its action plan, as well as initiate discussions on the way forward. Click below for more information.",Fact
"Children who are on social media for more than three hours a day are more likely to develop depression and anxiety as teenagers, according to research.
Experts said the impact was likely to be linked to a lack of sleep caused by using social media late at night, and that the link to depression was more pronounced in girls.",Fact
"It found that 93% of all recommendations in the EU executive's own 2025 rule of law report were repeats from previous years, many carried over with no change in the wording, while the number of new recommendations had fallen by half since 2024. Out of 100 commission recommendations assessed by Liberties, 61 showed zero progress, while 13 more were deteriorating.",Fact
"I yearn to live in a world where the semiconductor industry takes a modern approach to their tool design and usage by learning from the successes of the software industry, but we’re never going to get there if there isn’t a FOSS-initiative started between these companies. While I would love to be in a small team that creates these FOSS tools to help everyone, it’s simply not realistic for me to work a full-time job and create open-source software that major industries use.",Opinion
"Like those who believe that the mainstream media are dominated by the left, Döpfner wants to make the Telegraph “the most read and intellectually inspiring centre-right media outlet in the English-speaking world”. How he will do this remains to be seen, but he has already mentioned technology as a way of doing so. With a stated “mission” of becoming “the leading digital publisher of AI-empowered media in the free world”, he has sought to ease fears about job cuts with warm words about journalism.",Opinion
"The spread of invasive species across new parts of the world is also triggering allergic reactions in new populations of people. While originally from North America, ragweed, for example, has spread across Europe, as well as into Australia, Asia and South America. Already, some 60% of people in Hungary, 20% in Denmark and 15% in the Netherlands are reportedly sensitive to the pollen from this prolific group of plants.",Fact
"NASA just reported that the Double Asteroid Redirection Test, or DART, was successful in altering the orbit of the smaller body in a binary asteroid system. The space agency launched the DART probe in November 2021, taking nearly nine months before it hit the 560-foot or 170-meter-wide Dimorphos in September 2022.",Fact
"Netflix, Paramount and others are also experimenting with AI in a way that could empower new kinds of storytelling. Lionsgate Studios Corp. has partnered with startup Runway AI Inc. to lower production costs, and Walt Disney Co. has signed a deal to license its intellectual property to OpenAI Inc., which developed the Sora video creation tool. Netflix is also paying as much as $600 million to acquire InterPositive, the AI moviemaking company founded by Affleck, Bloomberg has reported.",Fact
"Acronyms function as shortcuts for words or longer phrases. Their correct resolution and disambiguation fully depends on the text around the acronym and the interpretation of the reader. In clinical narratives, acronyms are especially difficult to resolve due to a highly specialized and constantly evolving language, which lacks standardization. This is very relevant, because acronyms in clinical texts are usually not introduced, can have several meanings, are often only used in local scopes, and thus constitute a barrier to understanding not only for patients but also for physicians, even affecting patient safety.",Fact
"It is the giant African harvester ant queens, which are large and coloured red, that are most prized by international ant collectors – one can fetch up to £170 ($220) on the black market, which tends to operate online.A single fertilised queen is able to create a whole colony and can live for decades – and can be easily posted as scanners do not tend to detect organic material.",Fact
"Ramos requested her euthanasia in April 2024, prompting a legal battle with her parents who argued that she suffered from a personality disorder. The law group Abogados Cristianos furthered this argument in court, but the European Court of Human Rights later authorized the euthanasia, followed by the Spanish Supreme Court in January. Ramos, a victim of sexual abuse, made several suicide attempts throughout her life. An attempt in 2022 left her in a wheelchair, reportedly rendering her disabled.",Fact
"Limiting warming to 1.5?C implies reaching net zero CO2 emissions globally around 2050 and concurrent deep reductions in emissions of non-CO2 forcers, particularly methane (high confidence). Such mitigation pathways are characterized by energy-demand reductions, decarbonization of electricity and other fuels, electrification of energy end use, deep reductions in agricultural emissions, and some form of CDR with carbon storage on land or sequestration in geological reservoirs. Low energy demand and low demand for land- and GHG-intensive consumption goods facilitate limiting warming to as close as possible to 1.5?C.",fact
"The reality is that the way most people live is arguably worse for the environment than the average progressive college student living in D.C. When I’m here, I travel solely via walking or public transportation, I don’t own a car and I don’t eat much meat. There are a multitude of other factors that influence someone’s carbon footprint, but these are the main focuses of assessments like the one I took.",Opinion
"Anyone who is a permanent resident abroad may fly in Germany in accordance with the guest flight regulations with their domestic licence in combination with the FAI level 4 or 5 IPPI card. An IPPI card is mandatory for all foreign pilots. Minimum ratings are stage 4 for unsupervised flying and stage 5 for cross-country flights. With lower stages, flying is allowed under the supervision of a German instructor. Commercial flying with passengers is only allowed with tandem licences from Germany and Austria. Tandem licences from Swizerland and France are valid for occasional, private flights, not for commercial flights. No other tandem licences are valid.",Fact
"As the war has strangled the strait, freight rates for American LNG have quadrupled, and the Asian market has become a new center of gravity for the fuel as Asian countries scramble for new energy sources. Eighty percent of Asia’s fuel comes through the strait, and since the war began, at least four cargoes of US LNG have turned toward Asia from their original destinations in Europe.",Opinion
"In a town that gave birth to the disaster movie, it�s tempting to see such developments in apocalyptic terms. Owen Gleiberman, chief movie critic for the Hollywood Reporter, watched in horror as one highly touted movie after another flopped at the box office over the summer and early autumn � a reflection of changing audience habits and stiff competition for their attention from streaming services and smartphones. �It has seriously begun to look like the bottom is falling out,� he declared.",Opinion
Santorini is almost synonymous with luxury nowadays but it’s also possible to travel the island on a budget and many of the best things to do in Santorini are free such as strolling the historic towns taking pictures relaxing on the beach and seeing the sunset. A trip to the Greek islands wouldn’t be complete without seeing Santorini for at least a few days and it’s easier than ever to get there from Athens and other major cities in Europe.,Opinion
Visualizing the potential impacts of a hurricane on people's homes before it hits can help residents prepare and decide whether to evacuate. MIT scientists have developed a method that generates satellite imagery from the future to depict how a region would look after a potential flooding,Fact
"„My big takeaway from the 2003 U.S. invasion of Iraq — which I deeply regret having supported — is that the United States should go to war only when it has to. It should not engage in preventative wars against nebulous threats based on suspect intelligence and without a clear endgame. At one time, I had thought that President Donald Trump had reached similar conclusions. He denounced the Iraq War as “the biggest single mistake made in the history of our country,” criticized “nation-builders,” and vowed to “measure our success” by “the wars we never get into.”“",Opinion
"A global energy shock seems all but certain to come soon—the kind where even the best-case scenario is a disaster. The war could grind the AI build-out to a halt. This would be devastating for the tech firms that have issued historic amounts of debt to race against their highly leveraged competitors, and it would be devastating for the private lenders and banks that have been buying up that debt in the hope of ever bigger returns.",Opinion
"Nevertheless, I see that everything about her is super, for better or worse. In Portuguese, we have an expression that I like to use a lot and that explains what I mean. We say “eight or eighty”. In other words, it’s a lot or a little, it’s black or white, there’s no gray area. Going back to the text instead of discussing Brazilian expressions, Taylor Swift is either highly acclaimed or highly criticized. There is no middle ground. Her fans think she’s the greatest artist to have walked on this planet since Paul McCartney. Her critics, however, are on the other end of the rope;",Opinion
"Holloway, Alabama’s No. 2 scorer, was arrested March 16 after authorities found 2.1 pounds of marijuana in his apartment. He was suspended indefinitely following the arrest, but coach Nate Oats has not ruled out the possibility of his return in the NCAA Tournament.
Holloway’s attorney, Jason Neff, had requested his client be allowed to travel “on a trip out of the state” — without specifying where — departing Friday and returning Tuesday. Tuscaloosa County District Court Judge Joanne Jannik approved that travel Friday morning, according to court documents.",fact
"Much of my belief system is built around the fact that our resources as humans are not infinite. In all that we do as individuals, it is of utmost importance that we recognize this to live sustainable lifestyles. This idea is what proponents of reducing carbon footprint may be aiming to convey. However, forcing environmental actions onto individuals distracts from the big corporations, governments and other major polluters that are the most responsible for climate change and its consequences.",opinion
"Each year, we purchase between 160 and 200 million laptops. Using the data above, this means that the production of laptops requires a yearly energy consumption of 480 to 868 petajoules, which corresponds to between one quarter and almost half of all solar PV energy produced worldwide in 2018 (2,023 petajoules).  The making of a laptop also involves a high material consumption, which includes a wide variety of minerals that may be considered scarce due to different types of constraints: economic, social, geochemical, and geopolitical.",Fact
"After the US and Israel began their military strikes on Iran on February 28, oil and gas markets were plunged into chaos and energy prices shot up. As of today, Brent Crude Oil prices are 20% higher than in late February. They went from around $70 a barrel in late February to quickly surpassing $100, before falling to around $90 on March 10.",Fact
"Considering America's tumultuous political and economic relationship with China, one could question whether the issue of national security and data privacy is the sole motivator for the TikTok ban. After all, if the U.S. government were worried about data breaches in general, it would have looked for an intermediate alternative that allowed TikTok to remain in the nation while protecting Americans' digital information.",Opinion
