Content,Classification
"The war has been a masterclass in strategic myopia in Washington. For the Iranian leadership, survival now counts as a kind of victory. For Benjamin Netanyahu, a friendlier regime in Iran was desirable, but a hostile one whose capacity to menace Israel has been reduced to rubble is an acceptable second-choice outcome. But that is not adequate compensation to Trump. He is burning dollars and haemorrhaging prestige every day that the Islamic Republic constricts the flow of oil and gas to the global economy.",Opinion
"I would urge world leaders to recognize that climate change is not a distant threat, but a present reality shaping our economies, our communities, our daily lives, and our livelihoods. The policies and investments we make today will determine whether we simply react to crises or proactively build resilience. I'd emphasize the need for science-based decision-making, robust data, and a willingness to rethink traditional approaches.",Opinion
"Attention mechanisms have become an integral part of compelling sequence modeling and transduction models in various tasks, allowing modeling of dependencies without regard to their distance in the input or output sequences [2, 19]. In all but a few cases [27], however, such attention mechanisms are used in conjunction with a recurrent network.",Fact
"LeakBase has been operating since 2021, the authorities said, and had a continuously maintained archive of hacked databases, including hundreds of millions of account credentials, credit card numbers, and banking account and routing information. Europol said in a statement that around 100 enforcement actions were taken worldwide, including measures taken against the top 37 active users on the forum. Earlier on Wednesday, the FBI redirected the site's domain to nameservers controlled by the agency, effectively shutting the site down.",Fact
"Some Western geopolitical gambles in the Middle East have been calculated risks. Others were more like reckless experiments that left entire societies shattered. Too often, actions to empower ethnic or sectarian movements to weaken a hostile government fail to consider the broader chaos that is also unleashed. There is a moral weight to encouraging rebellion with life-and-death risks, a responsibility that policymakers often underestimate.",Opinion
"The SAVE Act is not gonna pass. The Trump admin knows this. It’s not supposed to. Its purpose is midterms. Once the House, Senate, or both starts to flip blue, Trump will cry “cheating!” and “this was why the radical left didn’t pass the SAVE Act!” As for the maga base, most our too obtuse to realize that America isn’t going to pass a bill on election security from a criminal that tried to cheat at an election.",Opinion
"The men's 100 metre freestyle competition of the swimming events at the 1991 Pan American Games took place on 14 August. The last Pan American Games champion was Todd Dudley of US. This race consisted of two lengths of the pool, both lengths being in freestyle. It was the first time that the U.S. lost the gold medal in the men's 100 meter freestyle, after 10 straight titles. This feat fitted Gustavo Borges, who went on to win four Olympic medals after this.",Fact
"This year?s update of the global MPI database includes new data from 20 countries. It presents MPI data from 112 countries covering 1,359 subnational regions. The results show that 1.1 billion of 6.3 billion people live in acute multidimensional poverty, over half of them children. Common deprivations include a lack of adequate housing, sanitation, electricity, cooking fuel, nutrition and school attendance.",Fact
"Pressed further as to whether he was leaving Howe's future open, he added:
""I would not frame it that way. We are not looking to make a change at the moment. We are not having those conversations.
""We are still in the midst of the season. Right now we are focused on the seven matches we have remaining and not distracting ourselves with speculation about what we may or may not do in the summer.
""Right now, all of us have only got so much bandwidth and we are focused on this season and finishing strongly.""",opinion
"The most disturbing possibility is that this might all seem perfectly reasonable to us. The same AI companions that hundreds of thousands of people are already falling for in their current primitive state will be making ultra-persuasive, charming, sophisticated and funny arguments for why our diminishing relevance is actually progress. AI rights will be presented as the next big civil rights cause. The “humanity first” camp will be painted as being on the wrong side of history.",Opinion
"Civil war broke out in Sudan’s capital, Khartoum, on 15 April 2023, when a power struggle between the army and RSF spiralled into open conflict. Since then, more than 11.6 million people have been displaced, out of a population of about 51 million, in what aid organisations have described as the world’s worst humanitarian crisis. Huge swathes of the country are at risk of famine.",Fact
"When water freezes, however, bonds are formed that lock the molecules in place in a regular (hexagonal) pattern. For nearly every known chemical compound, the molecules are held closer together (bonded) in the solid state (e.g., in mineral form or ice) than in the liquid state. Water, however, is unique in that it bonds in such a way that the molecules are held farther apart in the solid form (ice) than in the liquid. Water expands when it freezes making it less dense than the water from which it freezes.",Fact
"California's Digital Age Assurance Act (AB 1043), signed by Governor Gavin Newsom in October 2025, requires every operating system provider in California to collect age information from users at account setup and transmit that data to app developers via a real-time API, with the law taking effect on January 1, 2027. The law's broad definition of an ""operating system provider"" — anyone who ""develops, licenses, or controls the operating system software on a computer, mobile device, or any other general purpose computing device"" — pulls in not just Windows, macOS, Android, and iOS, but Linux distributions and Valve's SteamOS.",Fact
"Apple is reportedly focusing on a thinner and lighter profile for the iPhone 18 Pro. Advances in compact internal components and battery technology are expected to reduce overall thickness without compromising battery life or performance. The improved weight distribution will make the device feel more balanced and comfortable in hand, enhancing both usability and aesthetics.",Opinion
"Driving electric generally does save money. People who buy EVs have “really substantial” gas savings over the life of their vehicles even without government tax credits, says Peter Zalzal, an attorney with Environmental Defense Fund. “We’re talking about thousands and thousands of dollars” in savings, Zalzal says. “And as gas prices increase, those savings are only greater. Fuel costs are a big piece of overall vehicle costs, and increases in fuel prices have significant impacts on people.”",Opinion
"The cost of living emergency is the issue of our time. It is a crisis not months, but years in the making. For more than two decades, living standards have been crushed. The ambitions of millions of working people have been shafted by a system that does not work for them. It’s our job to show the British people whose side we are on.",Opinion
"First, an economic interest doesn���t necessarily make what someone is saying wrong, and I try to be transparent and not hide mine. Second, I tend to start with my beliefs and follow with my money. And sometimes that does mean doing things that are against my economic interests. Not kissing [Trump���s] ring, like many others have, is probably an economic limiter ��� but it���s better to be principled.",Opinion
"CO2 emissions hit an all-time high last year, and for the first time average temperatures on Earth rose 1.5 °C above preindustrial levels. To limit warming to 2 °C, massive amounts of carbon dioxide will have to be sucked out of the atmosphere and locked away, according to the Intergovernmental Panel on Climate Change (IPCC).",Fact
"When college students struggle to read passages longer than a phone-size paragraph and Hollywood struggles to compete with YouTube and TikTok, that’s the bottleneck putting the squeeze on traditional artistic forms like novels and movies. When daily newspapers and mainline Protestant denominations and Elks Lodges fade into irrelevance, when sit-down restaurants and shopping malls and colleges begin to trace the same descending arc, that’s the bottleneck tightening around the old forms of suburban middle-class existence.",Opinion
"When Donald Trump was elected for his first term in 2016, a large majority of Democrats believed the election was rigged. When Joe Biden was elected in 2020, a large majority of Republicans believed the election was rigged. America is the world’s showcase democracy. Why can’t we have elections people can trust? I’m usually critical of both parties, but when it comes to election integrity, the Democrats are 100 percent of the problem.",Opinion
"One potential step forwards could be for technology companies to establish a foundation that hosts a shared platform, enabling various sectors to conduct structured interviews with AI systems and publish the results. Such a foundation could draw on the best elements of Kaggle — a platform that hosts open competitions to advance AI capabilities — and MLCommons, a community that sets standards and builds tools for evaluating machine-learning performance. Done right, this shift has the potential to deepen our understanding of AI — and build public trust and excitement about what these technologies can achieve.",Opinion
"Even the happiest of marriages suffers the odd quarrel. The same goes for geopolitical alliances. When partners embark on a momentous endeavour, be it bringing up children or, perhaps, thwarting the neo-imperial designs of a Russian despot, some friction is to be expected. Thus it is that after four years of almost spousal solidarity, Ukraine and its European partners are going through a patch of conjugal bickering.",Opinion
"If you truly want to stop migration, then you must support Ukraine in every possible way. On the other hand, if you want to pacify Russia by cutting off Ukraine, you have to accept a flood of migrants. Anyone who wants to deny weapons to Volodymyr Zelensky should go ahead and clear out school gyms in Saarbrücken, Erfurt and Bochum for incoming Ukrainian refugees. Anyone ready to hand Ukraine over to Putin might as well set aside parks in Gotha, Chemnitz, Memmingen, Oldenburg, Emden and Annaberg-Buchholz for tent camps. Because people will come.",Opinion
"When the USS Indianapolis was sunk by a Japanese submarine on 30 July 1945 survivors were left in the water for four days, during which time around 600 men died of exposure, dehydration, and shark attacks. Experts believe it may be the single greatest concentration of shark attacks on humans in history.",Fact
"""As the broader games industry comes together in condemnation of Nvidia's DLSS 5 AI-slopificator technology, one man is brave enough to step forward and say something against the grain, to puff out his chest and speak up for the little billionaires. And that man is Daniel Vávra, one-time GamerGater and co-founder of Kingdom Come: Deliverance 2 studio Warhorse. He sees this leap forward for technology as a replacement for the expense of raytracing-you know, once it gets over its initial struggles. Because sometimes you just have to believe.""",Opinion
"""The 30% rule in AI is a guideline suggesting that AI should automate roughly 70% of repetitive, data-heavy tasks, leaving humans to focus on the crucial remaining 30% that demands creativity, critical thinking, ethical judgment, and complex decision-making. This framework promotes a balanced partnership where AI handles execution, freeing humans for higher-level tasks like leadership and building relationships—a balance vital for long-term workforce relevance and avoiding over-reliance on automation.""",Opinion
"Bernardo, then, is ideal for his manager’s artistry, allowing Guardiola to render his tactical ideas as they change. This season, that has meant responding to a Premier League increasingly emphasising physicality. Confrontations with Harry Maguire and Joelinton have demonstrated Bernardo’s willingness to provide bite as well as guile. City increasingly require edge and resilience in their midfield and with Silva providing it, he remains essential.",opinion
"OpenAI is shuttering the standalone app to focus on other priorities, the company said on Tuesday. “As we focus and compute demand grows, the Sora research team continues to focus on world simulation research to advance robotics that will help people solve real-world, physical tasks,” an OpenAI spokesperson said in a statement.",Fact
"Like a disease that bedevils epidemiologists with resistance to treatment, the modern Left’s attachment to racial preferences is proving hard to cure. Though voters have made clear they don’t want government or the private sector to base decisions on race, the Left keeps finding ingenious ways to reintroduce racial discrimination.",Opinion
"""It's just a shame that so much about Watch Dogs feels like Ubisoft playing catchup to Rockstar - like a cover band with one or two originals. City homage games might as well be their own genre now, but they'll need more than car chases and gunplay and clothing stores and weapon shops and all their little lookalike diversions if we don't want 'open-world' to become another pejorative term we use to express our boredom with a genre, like 'first-person shooter'.""",Opinion
"Some of StarmerÕs problems are of his own making, rather than the hostility of the media. The PM, a man who has undoubtedly made some poor decisions, too often fails to connect with the public. The fact he seems to adopt the same tone for all public speeches Ð whether referencing the war or his favourite snack food Ð makes him an easy target.",Opinion
"Burger King has introduced an AI chatbot into its daily fast food restaurant operations. 'Patty', the AI voice powered by an OpenAI base model, will live inside employees' headsets to collect data on 'friendliness' and simplify workflow. The bot is part of a new web and app platform, BK Assistant, that is designed to provide training and operational support. It's expected to do everything from alerting managers about items that are no longer available to helping workers remember the ingredients in limited-time offers. It will also analyze the conversations between employees and customers at the drive-thru window.",Fact
"To age like a fine wine shouldn’t, then, be a special compliment for those of us who are deemed to be doing it correctly – not least because at its heart sits the premise that ageing is, inherently, the process of becoming sullied. Here’s to growing old proudly and disentangling ourselves from the worship of youth.",Opinion
"No one believes a bean burger contains beef. Nobody assumes a veggie sausage came from a pig. Shoppers are not wandering supermarket aisles in a haze of confusion, clutching tofu and wondering which end of the cow it came from. People choose plant-based products deliberately, often for environmental, ethical or health reasons.",Opinion
"""No Man's Sky certainly falls into that category: it's been out for nine years and it's still getting updated regularly multiple times a year with new features. In 2025 alone, there have been updates that added new planets to explore, fossilized skeletons to dig up, a settlement management system, and huge new customizable starships. And as always, these updates are completely free.""",Fact
"NASA will host a public event at 9 a.m. EDT on Tuesday, March 24, at the Mary W. Jackson NASA Headquarters in Washington to outline how the agency is executing President Donald J. Trump-s National Space Policy and accelerating preparations for America-s return to the surface of the Moon by 2028. The program will open with remarks from NASA Administrator Jared Isaacman, followed by panels providing updates on mission priorities.",Fact
"The rate of global warming has surged since 2015 and is now nearly double what it was in the 1970s, according to a study1 that tackles one of the hottest debates among climate scientists. Because the past three years have shattered temperature records (see ‘Temperature boost’), researchers have been exploring whether global warming is accelerating, and if so, why. Many scientists agree that the rate at which it is increasing has picked up.",Fact
"I’m flabbergasted by the relentless pessimism I’m seeing in much of the commentariat. We are less than two weeks into a war that will almost surely be over by the end of the month, and already there are predictions that it’s 'another Iraq.' American casualties, heartbreaking as they are, have been minor for a conflict of this scale.",Opinion
"Newcastle's chief executive David Hopkinson says Eddie Howe's future will be discussed ""when the time is right"" as the club announced record revenues of £335.3m for the year ending June 2025.

The Magpies' turnover is up £15m from the previous year and commercial revenues have increased 44 per cent to £120.1m, but those figures remain significantly less than the Premier League's top clubs. Liverpool reported record revenues of £700m in their latest financial results, and Manchester United's projected revenue is £640m.",fact
"US gasoline prices surge at pace rarely seen The 33% increase in average retail gas prices in the days since the U.S. and Israel launched attacks on Iran is the largest such run up in at least three decades, topping the surges seen after Russia invaded Ukraine in 2022 and following Hurricane Katrina in 2005.",Fact
"Samsung's Galaxy S26 phones will gain the ability to use Apple's AirDrop this week, allowing the company's Galaxy phones to directly share photos and files with iPhone and Mac computers. Samsung is announcing the new feature Sunday night, which will need to be turned on from the phone's settings menu. The feature will be arriving in an update to devices over the course of this week, and when it does, the Quick Share settings menu will gain a Share with Apple devices toggle.",Fact
"A California jury found both Instagram owner Meta and Google's parent company Alphabet liable on Wednesday in a lawsuit brought by a 20-year-old woman who alleged that YouTube and Instagram were designed to be addictive to children. The verdict, reported earlier by Reuters, could have wide ramifications in a host of similar liability cases that have accused tech giants of intentionally creating addictive platforms to hook children as users.",Fact
"Amid her rant, the robot raises both arms, perhaps apologetically, or perhaps in exasperation. Either way, we suspect it did little to help its case. Later, the clip shows two officers escorting the mechanical troublemaker away, in what is probably the silliest perp walk you’ll lay eyes on. One of the cops even places a hand on the robot’s shoulder, humanizing the display.",Opinion
"More teens report spending too much time on social media: 45% of teens say they spend too much time on social media in our current survey, up from 36% in 2022. Girls’ experiences on social media skew more negative, at times: Teen girls are more likely than boys to say social media hurt their mental health (25% vs. 14%), confidence (20% vs. 10%) or sleep (50% vs. 40%).",Fact
"The game Dungeons & Dragons is currently published by Wizards of the Coast, a subsidiary of Hasbro. It has gone through multiple editions since its original release, including Advanced Dungeons & Dragons and the modern 5th Edition. Each edition updates rules while maintaining the core gameplay structure.",Fact
"The most popular car makes were VW (share: 16.7%), Skoda (11.3%), Audi (7.5%), BMW (5.8%), and Seat (5.3%). Double-digit gains were observed for Peugeot (+54.8%), VW (+25.9%) and Skoda (+11.2%). New registrations for Mercedes (+8.9%), Seat (+6.6%), Toyota (+3.8%), Audi (+2.9%), Cupra (+2.4%) and Dacia(+1.9%) also increased. In contrast, new passenger car registrations for BMW fell by 16.4% compared to January to February 2025.",Fact
"The EU carbon border levy, which launched on January 1, imposes a fee on the emissions associated with imported goods including fertilisers, steel and cement. The system, the first of its kind in the world, aims to protect European industries from being undercut by cheaper products from countries with weaker climate rules. France, Italy and Croatia are among the countries to call for it to be suspended for fertilisers.",Fact
"The amount of renewable energy capacity added to energy systems around the world grew by 50% in 2023, reaching almost 510 gigawatts (GW), with solar PV accounting for three-quarters of additions worldwide, according to Renewables 2023, the latest edition of the IEA s annual market report on the sector. The largest growth took place in China, which commissioned as much solar PV in 2023 as the entire world did in 2022, while China s wind power additions rose by 66% year-on-year.",Fact
"This game got me through a really dark place in my life. I lost my job, spouse, and home in less than a year. I would chop wood and fish when I couldn't find the energy to do anything else and fall asleep on the couch listening to the background music. I've put thousands of hours into Stardew Valley. The little successes I had were the catalyst I needed to think maybe I could have little successes again in life, too. Highly recommend. Thank you for making this game.",Opinion
"Along with its golden beaches and iconic cultural sights, Thailand boasts some of the world’s top restaurants, serving delicious food you won’t find anywhere else on the planet. But deciding what to order can be a tricky business. It’s tempting to stick to what you know, and go for a pad thai, tom yum or green curry. While it’s unlikely you’ll be disappointed with any of these, surely this is the moment to step out of your comfort zone and try something you can’t just get at home?",Opinion
"""Unfortunately the day has come. This is the first part of my farewell,"" Salah said in a video posted on Tuesday evening. ""I will be leaving Liverpool at the end of the season. ""I never imagined how deeply this club, this city, these people would become part of my life. Liverpool is not just a football club. It's a passion. It's a history. It's a spirit. ""I can't explain it in words to anyone not part of this club. We celebrated victory. We won the most important trophies and we fought together through the hardest time in our life.",opinion
"During the dark polar winter, the concentration of ozone in the upper atmosphere over the pole typically decreases because sunlight is a critical ingredient in making ozone in the first place. At the same time the circulation of air around the North Pole keeps all this low ozone air at higher latitudes near the pole. In March and April, as the sun moves north, this polar circulation begins to break down and occasionally allows pockets of low ozone air to break away. These can sometimes pass over the UK.",Fact
"I’m not sure what the neurological term is for something that stimulates memories of a smell, but… for me, the new science fiction movie Project Hail Mary has that in spades. As I watched the movie, I was overwhelmed by a formative and foundational scent from my youth: the way new science fiction paperbacks smelled back when I was 11 to 13… that scent of clean, fresh paper and ink.",Opinion
"„Household combustion devices, motor vehicles, industrial facilities and forest fires are common sources of air pollution. Pollutants of major public health concern include particulate matter, carbon monoxide, ozone, nitrogen dioxide and sulfur dioxide. Outdoor and indoor air pollution cause respiratory and other diseases and are important sources of morbidity and mortality. WHO data show that almost all of the global population (99%) breathe air that exceeds WHO guideline limits and contains high levels of pollutants, with low- and middle-income countries suffering from the highest exposures.“",Fact
"Immediately, US stock futures soared and oil prices fell. The Dow, which had been on the verge of -correction- territory last week - nearly 10% off its most recent peak - briefly surged more than 1,000 points. It ended the day 630 points, or 1.4%, higher. The broader S&P 500 gained 1.2% and the Nasdaq rose 1.4%. Now, because you-re all a bunch of Readers of News, you might be thinking: Come on, finance folks, are you really falling for this again?",Opinion
"The FBI has just arrested John Daghita, the lead suspect in a major crypto theft case tied to the U.S. government, where the perpetrator allegedly siphoned $46 million worth of cryptocurrency from state-owned wallets into his own accounts. The accused was taken into custody with the help of local French authorities in Saint Martin, an island in the northeast Caribbean, as confirmed by FBI director Kash Patel.",Fact
"In 2024, with support from environmental philanthropist Alan Noble, who donated funds in memory of his late wife, Beaman and Burke Da Silva bought a 530-hectare (1,300-acre) tract of plantation land bordering the Flinders Chase National Park, before it could be cleared by Kiland. Together with Noble, they co-founded The Koala Sanctuary, securing the habitat of roughly 1,000 koalas – around 10% of the island's remaining population.",Fact
