Content,Classification
"I could have said thanks and returned to my phone, but instead I made a conscious decision to put it away and be open to a new connection. The conversation uncovered many delightful facts about them both and spanned many topics: theatre, travel, politics and even the ancient Irish origins of bards and their modern equivalents.",Opinion
"Donald Trump is alone. That’s different from the United States being alone. We – that is, the vast majority of Americans who were against Trump’s war from the start, and who support Nato and the United Nations charter and the post-second world war system of alliances and rules – are not alone. Most of the people of the United States stand with most democracies of the world.",Opinion
"Growing up in North Carolina, I am acutely aware of the spring ritual in which the hopes and dreams of college basketball fans come swirling together into the NCAA's annual tournament.A longstanding part of the March Madness ritual has been forecasting the winners (aka filling in brackets) – and betting on them. For decades, most of what I saw were low-wager pools among co-workers or friends. Although I knew there was big money flying around.,",Opinion
"In a stunner of a result - ""the best thing in 50 years,"" in the words of one of the world's leading computer scientists - Ryan Williams, a researcher at the Massachusetts Institute of Technology, found that memory is far more powerful than anyone had realized. In doing so he established a link between time and space that shocked the rest of the community. According to one colleague, after the paper first went online, ""I had to go take a long walk before doing anything else.""",Opinion
"In more than 60 years of space activities, more than 6050 launches have resulted in some 56450 tracked objects in orbit, of which about 28160 remain in space and are regularly tracked by the US Space Surveillance Network and maintained in their catalogue, which covers objects larger than about 5-10 cm in low-Earth orbit (LEO) and 30 cm to 1 m at geostationary (GEO) altitudes. Only a small fraction - about 4000 - are intact, operational satellites today. This large amount of space hardware has a total mass of more than 9300 tonnes.",Fact
"A lot of frozen barren land, beautiful forests, some mountains, and polar bears in these areas.  Arctic Canada has shocking food prices due to the need to fly anything in. There are ice roads and some places are only accessible by flying in. The southern parts of your circles are more similar to regular Canadian culture, the further North the more alienating it is.  A lot of oil and gas, forestry, and mining going on up here. Not much else",Opinion
"For my tastes, I still want that high-end experience, so I play Fortnite on my PC or my Xbox Series X most of the time. Switch 2 players have now joined the fray as the latest platform to host Epic's everything-game, and though it's a downgrade for those like me, for Switch 2 players, it's a sizable step forward.",Opinion
"By 2030, 1 in 5 Americans will be over 65. Already, 1 in 4 adults are caregivers, and nearly 30 percent of caregivers are part of the sandwich generation supporting both young children and aging parents. These realities are placing increasing pressure on families, many of whom are trying to care for relatives remotely. Thankfully, this is one area where technology can offer transformative solutions.",Opinion
"Brazilian cosmetics maker Natura said that U.S. private equity firm Advent has signed a binding agreement to buy a stake in the company, while also announcing a board reshuffle that includes the departure of its founders. Advent International will buy between 8% and 10% of Natura for an average price target of 9.75 reais per share, the company said in a securities filing.",Fact
"Flexible work alone isn’t enough to alleviate the enormous challenge of starting and raising a family in America, where family-supportive policies are scant and sky-high child care costs rival the cost of housing in some states. The pandemic showed we can change the way we work so that it works for business and for families. It’s not that hard to do. With the future at stake, it’s time we doubled down on that.",Opinion
"The NHS employs around 1.7 million people, which accounts for 5% of the total British workforce. Around 77% of them are female, and 30% are nurses. To put those figures into further context, McDonalds employs 1.9 million staff worldwide, and Walmart employs 2.3 million. The two largest employers in the world are the US Department of Defense (3.2 million) and China’s People’s Liberation Army (3.2 million).",Fact
"For 2024, the most recent year for which data is available, the FBI found $16.6 billion in reported losses, beating the previous record, $12.5 billion, in 2023. The CFA looked at multiple estimates of how frequently scams go unreported in particular, an extensive 2017 study from the U.S. Bureau of Justice Statistics that found that the government hears of about 14% of scams to create a ballpark minimum figure of how much people are actually losing.",Fact
"In other words, A.I. chatbots allow us to keep saying the same things to ourselves. That’s not how healthy patterns emerge — or how happier lives are made.In other words, A.I. chatbots allow us to keep saying the same things to ourselves. That’s not how healthy patterns emerge — or how happier lives are made. … Used with awareness, A.I. can be a companion in moments of uncertainty.",Opinion
"The disc florets are yellow in color, while the ray florets are usually white to pink in color but can also have a deep red color. The maximum height is 25 cm, the leaves are round shaped and arranged in a basal rosette, and the stem does not have any leaves [1].",Fact
"And, of course, the rapid pace of the AI industry can’t stop to wait for more sustainable energy options to be built up — or to hear out the protests of locals who are alarmed at how the tranquility of their town was blown up practically overnight by an installation that feels like it was designed by Sauron himself. The noise drove resident Krystal Polk to move out of her home which her family owned during a time when many Black families were still sharecropping, she told NBC News.",Opinion
"First, there's the economics. Skiing is vastly more expensive than the average holiday, once you factor in all of the accoutrements: specialist jackets, trousers, gloves, goggles, helmets, boots - the ugliest clothes you have ever seen in your life, by the way - poles, skis, extortionate",Opinion
"'Thank you all. The score is 10-0. Thank you, Serbia, for the enormous trust.' With these words, Serbia's president Aleksandar Vucic declared election victory on Sunday night from the headquarters of the Serbian Progressive Party (SNS). Local elections were held in 10 municipalities across Serbia, with 247,985 citizens eligible to vote.",Fact
"One of the most consequential decisions of modern social media when it comes to the spread of digital falsehoods and foreign influence was the idea that anyone anywhere could publish on anything. While this gave voice to the formerly voiceless, it also gave rise to a world in which everyone viewed themselves as experts on everything.",Opinion
"On Feb. 13, 2023, a cosmic bullet of sorts zipped beneath the Mediterranean Sea near Sicily. It was a subatomic particle known as a neutrino, traveling through the depths at virtually the speed of light and carrying a whopping 220 peta-electron volts of energy. Its presence was detected by a new underwater observatory known as the Kilometer Cube Neutrino Telescope, or KM3NeT.",Fact
"In 1984, Bennett and Brassard developed the first concept of a quantum encryption key — one that the sender of a message could share with the receiver in a stream of photons. They showed that any device trying to intercept that stream would destroy the information stored in the photons, thereby revealing that the transmission had been intercepted. Later that decade, Bennett led a team at IBM that first demonstrated technique experimentally.",Fact
"As the book detailed, an experimenter informed participants—called “teachers” in the study—that they would be administering progressively stronger shocks to people called “learners.” The shocks were not real, but participants thought they were. The majority of participants proceeded to shock learners despite hearing screams of apparent agony. Under the experimenter’s direction, two thirds of participants in the study’s canonical version continued to the highest voltage level, even when the learner complained of heart problems and later stopped screaming, presumably having lost consciousness.",Fact
"Newegg has dramatically increased the price of some Corsair Vengeance DDR5 and G.Skill Trident Z5 memory kits, widely regarded as among the best RAM, to a mind-blowing $3,980. We've contacted the retailer to clarify if this was a planned price adjustment or a pricing error, but we have yet to receive a response. The uncertainty leaves consumers in suspense regarding the future of memory affordability. Given the steep increase and a single specific price applied to multiple different brands and capacities, an error of some description seems more likely.",Opinion
"In a groveling apology for the memo, Amodei explained he had written it immediately after Trump and Hegseth announced measures that would significantly damage Anthropic's business relationships and after OpenAI revealed its Pentagon deal.""It was a difficult day for the company, and I apologize for the tone of the post,"" he wrote.""It does not reflect my careful or considered views. It was also written six days ago, and is an out-of-date assessment of the current situation.""",Opinion
"Whatever their level, workers need curiosity and drive. Educators should provide flexible learning that meets people where they are. Employers need to offer support, mentorship and space to reskill. We can’t predict every change that’s coming. But we can build the capacity to adapt. That’s what readiness really is – not a state of arrival, but a shared commitment to growth.",Opinion
"Peter Schneider, a German writer whose novels like ""Lenz"" and ""The Wall Jumper"" charted his country's tortuous course through the late 20th century, from the social tumult of the 1960s through the fall of the Berlin Wall and the uneven reunification of West and East, died on March 3 at his home in Berlin. He was 85.",Fact
"The stunning and ominous rise in antisemitism in the United States cannot be disputed, but can be resisted. It is particularly the obligation of genuine Christians to participate in the repression through education of the ancient evil. It is the particular obligation of Christian institutions — churches, colleges, publishers and more — to do their part in making this sin once again an obvious source of shame and to help cure those who suffer from it and, where it cannot be cured, to force it back by shaming and shunning into the deepest shadows where it belongs.",Opinion
The freshly baked ranking of the world’s best pizzas includes the pizza capricciosa from 180grammi Pizzeria Romana in (you guessed it) Rome the SRP marinara from Short Road Pizza in London and obviously a margherita from Pizzeria da Attilio in the motherland Naples. However one pizzeria’s creation topped them all. The winner of the world’s best pizza for 2026 is in New York – duh. Buried deep beneath a generous dollop of mascarpone blobs of aged mozzarella and a hearty grating of both pecorino romano and parmigiano reggiano is the Cacio e Pepe slice from Mama’s Too in Manhattan.,Opinion
"Acronyms function as shortcuts for words or longer phrases. Their correct resolution and disambiguation fully depends on the text around the acronym and the interpretation of the reader. In clinical narratives, acronyms are especially difficult to resolve due to a highly specialized and constantly evolving language, which lacks standardization. This is very relevant, because acronyms in clinical texts are usually not introduced, can have several meanings, are often only used in local scopes, and thus constitute a barrier to understanding not only for patients but also for physicians, even affecting patient safety.",Fact
"Set within a valley of clear lakes and deep forests and framed by the Purcell and Selkirk mountains, the Slocan region has long drawn travellers seeking raw, rugged beauty. In 2026, the Japanese Canadian Legacy Trail – a self-guided route honouring those forcibly uprooted and confined here during World War Two – will add deeper meaning to that landscape.",Opinion
"As every parent knows, their permission is needed at school for everything from field trips to special holiday meals, but apparently the dissenting trio believes there is an argument to be made for not telling parents their child has changed their gender. Abject madness. Worse, when you think it through, is that instead of talking about this legitimate mental health challenge with their folks, children are supposed to trust other adults more to make decisions about their gender and sexuality, an incredibly dangerous idea.",Opinion
"Bacterial antimicrobial resistance (AMR) was found to be directly responsible for 1.14 million deaths in 2021, and an estimated 39 million people are expected to die due to AMR between 2025 and 2050. Already, it's estimated that millions of children are dying each year from infections resistant to antibiotics. The cause of the AMR crisis is usually attributed to the misuse and overuse of antimicrobials in humans, animals and plants.",Fact
"The Philippines has declared a national energy emergency in light of the conflict and ""the resulting imminent danger posed upon the availability and stability of the country's energy supply"". The impact here of a war more than 7,000km (4,300 miles) away is being felt strongly - with the country's jeepney drivers among the worst affected.",Fact
"GenAI user studies suggest that current systems make easy tasks easier and hard tasks harder for users, a phenomenon we have termed task-complexity polarization (and referred to as ""clumsy automation"" in the Human Factors literature [125]). Thus, it appears that these systems are not applied effectively to reduce overall workload. Human Factors research shows that one of the ways to address this is by clearly specifying how tasks are allocated between the human and system, particularly during high workload periods [41, 120].",Fact
"In the first of several experiments, researchers fed interpersonal dilemmas that were obtained from the Reddit forum and two other data sets to 11 large language models (LLMs, the AI systems that power chatbots), including models from companies such as OpenAI, Anthropic and Google. The researchers then compared AI responses with those of human judges.The human judges endorsed the user’s actions in about 40% of cases, whereas most LLMs did so for more than 80% of cases.",Fact
"About 20% of the world's oil and liquefied natural gas (LNG) usually passes through the Strait, and the war has sent global fuel prices soaring. In their recent 15-point peace plan, US negotiators said Iran would be required to reopen the Strait - among other demands - as a precondition for ending the war.",Fact
"To investigate the mechanisms underlying megadune formation, the research team used a dune simulation model to examine how topography influences their evolution under conditions of ample sand supply and a constant wind regime. The study found that more than 97 percent of the world's megadunes are concentrated in the Sahara Desert and the arid regions of Asia. Abundant sand sources and strong winds provide the basic conditions for the growth of megadunes. By contrast, deserts in Australia rarely develop into megadunes due to relatively high vegetation cover and limited sediment transport.",Fact
"The digestive system is made up of a muscular tube that starts at the mouth and ends at the anus. The stomach is an enlarged pouch-like section of this tube. It is found on the left side of the upper abdomen. The stomach’s shape and size vary slightly from person to person, depending on things like your sex and build, but also on how much you usually eat. It is between 20 and 30 centimeters long on average, and can hold about 1.5 liters of food and drink.",Fact
Pokémon Pokopia is a real treat: an enjoyable building and town simulator that capitalizes on the charming personalities of its monsters in a way that appeals to both the creative and collector alike. It's packed with fun things to do and worthy rewards for doing them and strikes a healthy balance between freedom and suggestion in its building mechanics (despite a few precision nitpicks).,Opinion
"Beyond the drama, Claude Code and Claude Cowork — developer and productivity tools released in January — have been drivers of subscriptions. The Computer Use feature, released this week, has also sparked a surge, Anthropic tells TechCrunch. That feature allows Claude to navigate a computer independently — clicking, scrolling, and taking actions on its own. It works with Dispatch, which lets users assign tasks from their phones. These features are not available to free-tier users.",Fact
"Two studies led by Johns Hopkins Kimmel Cancer Center, Ludwig Center, and Johns Hopkins Whiting School of Engineering researchers report on a powerful new method that significantly improves the reliability and accuracy of artificial intelligence (AI) for many applications. As an example, they apply the new method to early cancer detection from blood samples, known as liquid biopsy.",Fact
"According to a report published by Egypt’s Ahram Online on Sunday, 1st March, the global commercial aviation sector stands to lose over US$1 billion thanks to the current conflict.

Experts estimate that even the suspension of a single day in operations in key locations like Dubai could lead to a loss of up to US$215 million in revenues, driven by grounded flights, suspension of cargo ferrying, and even airport retail coming to a standstill.

Consider this: Indian airlines cancelled 410 flights as attacks began on the 28th, then an additional 444 on the following day.",Fact
"More than 70 young men responded to an advertisement about a “psychological study of prison life,” and experimenters selected 24 applicants who were judged to be physically and mentally healthy and well adjusted. The paid subjects—they received $15 a day—were divided randomly into equal numbers of guards and prisoners. Guards were ordered not to physically abuse prisoners and were issued mirrored sunglasses that prevented any eye contact. Prisoners were “arrested” by actual police and handed over to the experimenters in a mock prison in the basement of a campus building.",Fact
"Next, the scientists randomly selected a small number of embeddings (from a minimum of 4 to a maximum of 32) per dataset to train a logistic regression classifier, a type of linear model that predicts a discrete outcome. Results of the training, which have been detailed in a paper presented at the NeurIPS conference workshop on AI for Non-Human Animal Communication last December, showed that the classifier performed well even with just a handful of embeddings, and performance improved as the number of embeddings increased.",Fact
"Extreme weather is no longer just an environmental issue   it is core to government competence. By failing to prepare, communities are left exposed and political credibility is at risk... Progressives should work to tackle both the root causes and protect people from the immediate impacts.",Opinion
"Chemoautotrophs are organisms that can create energy from chemical reactions, a process known as chemosynthesis, as opposed to plants which need sunlight and carbon dioxide to perform photosynthesis. These chemical-consuming microbes often form close symbiotic relationships with invertebrate hosts, providing them with nearly all of the nutrition they need.",Fact
"I don’t want my medical insurers to know, for example, that I’ve been researching coronary artery disease. And even though my personal safety and liberty probably aren’t at stake, I don’t want to give any support to the global advertising behemoth, by allowing advertisers access to better information about me. Unfortunately, while distancing yourself from Google and its services might be a necessary first step in protecting your privacy, it’s far from the last. There’s more to do, and it’s getting harder to do it, because of browser fingerprinting.",Opinion
"As a competitive qualifying campaign starts to heat up across the globe, the selection process and training for the 33rd team at the FIFA Women’s World Cup 2027™ has already begun. While hosts Brazil and 31 additional qualifiers compete next year for the most coveted trophy in the game, that elite 33rd team – the match officials – will be working hard to ensure that the eagerly anticipated tournament is refereed at the very highest level.",Fact
"We have this terrible habit of wanting to look back at history and copy and paste it exactly into modern times. They didn’t have a captured media, they didnt have a surveillance state, the Supreme Court wasn’t at the whim of the president. That doesn’t mean we should give up, but we need to stop pretending this is going to look the same as other movements. We must adapt our expectations and stop complaining that protests don’t mean anything. It’s about organizing and meeting your community. Good god people, stop with the doomerism.",Opinion
"many women are choosing to do Pilates over other exercise modalities for reasons that are more regressive than we’d like to admit: We don’t want to look “fat” or “bulky” and are led to believe, by Pilates culture, that Pilates is the exclusive means to achieving the type of body that’s currently upheld as the gold standard for women — slender, yet “toned.”",Opinion
Overall the meal was good. For the price…it was very good. I wouldn’t choose the starter again but I was really happy with the main and loved the dessert. The fact that you get 3 courses with a glass of Prosecco for such a reasonable price is a big draw. I think this is a great option for Christmas parties or a friendly get together.,Opinion
"Surely, only a very contrary mindset would lead anyone to deny the utility of marine protected areas (MPAs). Facing the triple global crisis of climate change, biodiversity loss and pollution, it is as clear as day that the best interests of our own well-being lie in giving the ocean all the help it needs.",Opinion
"IBM has publicly stated that 2026 will mark the first time a quantum computer will be able to outperform a classical computer — the point at which a quantum computer can solve a problem better than all classical-only methods. According to IBM, this milestone will unlock breakthroughs in drug development, materials science, financial optimization and more industries facing incredibly complex challenges.",Fact
"Just because the Oscars ceremony is over doesn't mean the celebrations are. What follows the Academy Awards is the famous Vanity Fair Oscar after-party, where Hollywood's biggest stars swap the formal ceremony for a night of fashion, glamour, and after-hours revelry. And this year was no exception. Priyanka Chopra stepped onto the grey carpet arm-in-arm with Nick Jonas, and the power couple clearly understood the assignment, delivering a head-turning moment with their effortlessly coordinated looks.",Opinion
"We had the best time in France and as promised, I’m sharing a full breakdown of our trip here. This blog post will be long, but I’m doing my best to answer all the questions you sent in.  I’ll start by giving a trip overview, then I’ll break down an itinerary for each city we went to, I’ll answer FAQ regarding VAT refund, driving, money, etc.",Opinion
"The systemd project merged a pull request adding a new birthDate field to the JSON user records managed by userdb in response to the age verification laws of California, Colorado, and Brazil. This is the same record that already holds basic user metadata like realName, emailAddress, and location. The field stores a full date in YYYY-MM-DD format and can only be set by administrators, not by users themselves.",Fact
"GNN reported that 2025 saw a sharp rise in the fertility rate in South Korea, the world’s least-fertile country. On March 19th, Sreydani, an immigrant from Cambodia, and her husband Jeong Hae-deok, welcomed their son Yong-jun into the world. The town of Eunha-myeon in Hongseong County hung a banner down main street in his honor. The population of Eunha-myeon has fallen from 2,600 to below 2,000 over the last 6 years. It’s one of the smallest in the country, and a typical example of the effects of demographic collapse threatening countries of all cultures all over the world.",Fact
"The world urgently needs a shared, global understanding of artificial intelligence; grounded not in ideology, but in science; not in fake news, but in knowledge. That is where you come in. Your role is to bring independent, credible science into the global conversation — and to do so at a time when geopolitical tensions are rising, conflicts are raging and the stakes for safe and responsible AI could not be greater. In this fractured context, an unbiased and trusted understanding of AI is essential.",Opinion
